file,text,categories
/work/blog_data/137281311.welcome-to-day-1-of-100daysofnetworks.html,"Hello everyone! Welcome to day 1 of the 2023 edition of #100daysofnetworks!As some of you are probably aware, this is the SECOND iteration of this adventure, with the first taking place in 2020. I learned so much from that first adventure, and I'm excited to do this again.This first post is going to be a bit long, as I'd like to tell a bit about who I am and what I have in mind.Who am I?My name is David Knickerbocker. I am a software engineer. Since childhood, I have been obsessed with getting computers to do interesting things. As a child, I was excited when I could programmatically get them to make beep boop noises, and then became interested in creating ASCII art after that. As a teenager, I spent a lot of time building (and breaking) computers. As an adult, my earliest obsession was web development, but that has shifted to data engineering and then to data science. My entire life has revolved around working with computers and getting them to do what I want them to do.My career has entirely been in Information Technology (IT), but this has led me to working as a web developer, SQL developer, database administrator, data operations (dataops) engineer, data engineer, platform engineer, and now I am chief engineer in a company I am helping build.My entire career's emphasis has been to help people. This has led me to working in cybersecurity, in a hospital, in companies that help the U.S. Military community, and eventually to building a company to solve certain specific problems. For me, everything I do and build is about using technology to help humans. I don't care about cybersecurity for the sake of cybersecurity or because it pays well. Helping people is my central mission.Now, my work is focuses around Natural Language Processing (NLP) and Network Analysis. The things I will discuss as part of this adventure are the types of things I work on at work. This isn't a hobby, it has real-world applicability for solving problems. These days, I am most obsessed with network and NLP insights. I enjoy using NLP and networks to map out relationship and to find hidden insights. The marriage of NLP and networks makes this possible.Outside of work, I enjoy hanging out with my cats (Eddie and Echo), playing guitar, collecting fancy rocks and minerals, and playing video games.This is Eddie. :)Why am I doing this?I launched the first iteration of this adventure in 2020, after completing more than 100 days of #100daysofnlp. During the NLP adventure, I noticed just how much network data was available in the wild, and how incapable I was at doing more than surface level network analysis. I decided that I wanted to go much deeper. After 100 days of Natural Language Processing, I had built up a lot of skill and confidence. So, I wanted to see how far I could go with networks.The answer is that it took me very far. It took me so far that I got a book deal and a company out of it, and am now so comfortable with network analysis that it has become muscle memory.However, I haven't been able to focus on learning new things about networks as I once was, and there is more that I have been wanting to explore, but haven't found time for, and haven't had a reason to commit. This adventure is my commitment to spending another hundred days (at least), learning new things about network analysis and network science. I am excited to see what I will learn, this next iteration, and I'm excited to get others excited about this stuff as well. This is a creative outlet for me, but it is also research. Things I have learned in the first adventure, I use at work, and they went into my book. Stuff I learn in this new adventure, I will use at work, and they will appear in the second edition of my book.This adventure will lead to new insights and techniques, and it will build skill, confidence, and intuition, as well.Finally, the last reason is selfish: I enjoy sharing knowledge. I enjoy talking about cool stuff I'm learning, and useful things I have learned.What did I learn in 2020?I can still remember day 1 of the earlier #100daysofnetworks. I had just completed #100daysofnlp and felt so inadequate in my ability to use large networks. The first days were very awkward, for me. I had been working with network analysis since about 2018, when I was using network science for understanding dataflows as a data operations engineer, but I had never analyzed of visualized networks with thousands of nodes. Back in 2018 or so, I had also built my first social network, using text from the book of Genesis as data. I wanted to do more stuff like that, so I did. I found that practically any text could be used for constructing networks. I wrote about that in my book. I will be showing more of that in this project. In 2020, I was still using networkx for network visualization, and I suspected that there were better libraries available. There's still no great way to visualize networks in python, but it's getting better. I've shown how I do it, in my book, and that'll be part of this project as well.I learned so much from reading various books on Network Science, Social Network Analysis, and Natural Language Processing. I will do another post about my favorite books, in upcoming weeks.I learned some cool stuff about network fragility, but didn't explore the topic much. I plan to go into that further during this next iteration.And everything I learned, from my own experience before 2020 to everything I read about in 2020, I practiced those techniques, build skill and confidence, and described them in my book, and I use these skills in my company as well.What am I doing differently in 2023?Most importantly, I am setting this up properly.I have created a github repo: https://github.com/itsgorain/100daysofnetworksI have created a blog (you are reading it)I will post on LinkedIn, directing to this blogI wrote a book last year, and you should read it to learn more!As I have written a book on this, I've build up an understanding of how this can be taught from basics to advanced, and I will follow that path this time, rather than being so disorganized as I was before.What is the plan?I plan on teaching the following, in the following order, but I may jump around a bit, to keep this organized but still a bit flexible. Introductions - this postBasics w/ networkx pre-made graphsOpen datasetsBuilding networks, manuallyBuilding networks, automatically, using textCreating datasetsCleaning networksGraph metrics (centralities, etc)Connected componentsSubgraphsEgocentric Network AnalysisCommunity DetectionNetwork weakness and destructionTons and tons of playing with interesting datasetsGraphs and machine learningI am open to requests, but won't always say yes. If there's something that you'd like explored, participate on LinkedIn and let me know what you are curious to see.What else will be covered?If I'm teaching anything related to networks, Natural Language Processing will be included. NLP and Networks go together like <two things you like together>. Peanut butter and jelly, peanut butter and honey, steak and pepper, classical music and heavy metal.I will also be discussing Network Science and Social Network Analysis, and differences between the two, and how they are used together.I would also like to dabble with causal discovery, but am still exploring and learning. I will do my best to include it in this adventure. We have time.My first use of Network Science was in mapping out dataflows and identifying critical points. I haven't discussed that much, and I'd like to show how I do this. I wrote very briefly in my book about this, but can spend a day or few on it in this adventure.Finally, Machine Learning and Data Science is a given. Final ThoughtsI think this is going to be so much fun, and it gives me a creative outlet. It's useful and therapeutic to have a creative outlet, and the structured approach will allow me to expand my knowledge on what I am interested in, and I'm excited to be able to share this adventure with you as well, so that others can learn from this and get excited.Network Analysis is a useful skill. If you have any data at all, building skill in Network Analysis will very likely give you new opportunities and perspectives in using that data.I am going to disable comments on the blog, so that I do not have to spend my time moderating this. Please interact with me and the data science community on LinkedIn! Please join https://www.linkedin.com/feed/hashtag/?keywords=100daysofnetworks and learn with us! Feel free to use the #100daysofnetworks hashtag for your own adventure, and follow along!Finally, if you like what I'm doing, please buy a copy of my book. You will learn from me during this adventure, but I also put a lot of time and energy writing a book about it. And after reading, please leave a review on Amazon so that others will find my book! Thank you!","['Artificial Intelligence and Machine Learning', 'Community Detection', 'Egocentric Network Analysis', 'Graph Algorithms', 'Graph Visualization', 'Subgraphs and Connected Components']"
/work/blog_data/137283125.day-2-of-100daysofnetworks.html,"Welcome to day 2 of #100days of networks. If you would like to learn more about networks and network analysis, please buy a copy of my book!Today, we are going to start with the WHAT and WHY behind understanding networks. I'm going to explain what networks are, where we can find them, and why they are useful to explore, analyze, and understand.Let's do that, real fast, and I'll discuss deeper in the remainder of this post.WHAT: a network is just a manifestation of things and their relationships. WHERE: networks are all around us, and network data is easy to get.WHY: being able to analyze networks gives us new ways to understand the world and universe.You should study network analysis, because networks are everywhere, and learning how to do this will give you skill to be able to analyze and explore data in new ways.Ok, back to the beginning. What even is all of this? What are we going to discuss during #100daysofnetworks? What am I going to discuss in this specific post? My plan is to start at the beginning, describing networks and parts of networks, and describing why you should care.In this post, I will discuss the following:What is a network?What is a node?What is an edge?What is a community?What is a subgraph?If you read my book or followed along with the first iteration of #100daysofnetworks, then you probably know the answer to all of these questions, but I am hoping to introduce this topic to more people, so it is important to start at the beginning. Today's discussion will be about networks, their parts, and how they manifest in seemingly everything around us.The point of this is to show how pervasive networks are and to explain that being able to explore and interrogate them gives us new abilities in understanding life and the world around us. Life is not flattened, structured data. Life is complex.What is a network?As mentioned above, a network is just a manifestation of things and their relationships. I'm sure that a more academic definition can be found, but at the end of the day, a network is things and relationships.A graph, on the other hand, is a representation of a network, for use in analysis, prediction, etc.Often, I will use the terms graph and network as synonyms. That's common. People will often use the following phrases:Graph TheoryNetwork ScienceSocial Network AnalysisGraph Data ScienceThere is so much overlap. I personally think of all of these as related. I apply Network Science when I am doing Social Network Analysis. I do not call what I do as Graph Data Science, but other people do. I like to keep things simple and just consider all of these as parts of Network Science, similar to how there are different domains in Data Science, or different domains in Software Engineering. That's how I think about all of this. A network is a manifestation of things and their relationships, and a graph is a representation of a network. That's how I see it. A network exists in the real world, and we often cannot know all of its parts. We can be aware that the network exists, and we can be aware of parts of the network, but we cannot see or understand everything. A graph is our representation of what we know of the network. Perhaps we have--on paper--created an edgelist after watching people's social interactions and hand-drawn the network of how people have interacted. We've created a graph. If we add arrows showing the directionality of the relationship, we've created a Directed Graph, etc, etc. But I slip up all the time. I'll have a whole day where I will call everything a network. Sometimes this is intentional. If in one sentence I call something a graph, and then in the next sentence I call something a network, a person may think I am talking about two different things. Or if they are from cybersecurity, they'll by default think I am talking about a computer network.So, graphs, networks, they're synonymous to me, and I work with them every day. You can be more strict with yourself, if you like.Regardless, networks exist in the real world and they are represented as graphs, and we can use graphs for analysis, prediction, and so on. Graphs are simultaneously a tool, a map, and a usable data structure. When they are visualized, they are often beautiful, like art.Networks are all around us. Here are some examples, and we'll cover several of these during this adventure.People NetworksAdversaries and Allies (Social Network)Collaboration Network (Authors, Teams, etc)Communications Network (Email, Tweets, Telegram, etc)Computer NetworksMusic NetworksSongs and GenresArtist CollaborationsSong Evolution (Song -> Remix)User Songs (for recommendations)Data NetworksEntity Relationship Diagram (RELATIONSHIP is a giveaway)Dataflow Diagram (Code -> Data)Amplification (websites, social media accounts, etc)Knowledge GraphThis is a very short list, just off the top of my head. What other kinds of networks can you imagine? Think about what we are doing when we try to 'network' with other people. We are attempting to start some kind of relationship with other people so that we can find opportunities. Analyzing networks is another way to identify opportunities or understand reality.Here is a visualization of the social network from Les Miserables. Here is the same network with labels.What is a node?As mentioned before, a node is a thing in a network. A node can be a person, a song, a food ingredient, an outcome, a computer program, a data file, a database table, etc. Use your imagination. A node is just a thing.To keep things simple, hold the idea of a node as being a person or a computer. We all understand that human relationships are a thing, and we are all probably aware that computer networks exist. Computers are nodes on a computer network. People are nodes on a social network.A node is shown on a network visualization as a dot or circle.What is an edge?An edge is a relationship between two nodes. Put another way, an edge is a relationship between two things. Put another way, things have relationships with things, and they are portrayed as an edge.An edge is shown on a network visualization as a line. The edge is the line that exists between two nodes, the line that exists between two dots or circles.I am one person. You are another person. If you are reading this, you are interacting with my words. We now have an author/reader relationship. We now have an author/reader relationship. I am one dot, you are another, and there is a line between us. In the real world, nobody can see that line, but it exists.What is a community?A community is a group of connected things. Typically, when we talk about communities, we are talking about living things. However, there is such a thing as communities of websites, communities of social media accounts, etc. We could say that that's because there are people behind those websites and people behind those accounts, and I'd agree with that. But community detection algorithms are useful beyond studying living things. I will show how to identify and visualize communities in the near future. We will use community detection very often.To keep things simple, going back to our idea of people networks, a community would be a network of connected individuals. For instance, families are densely connected. We tend to interact with people we live with. Work networks are less densely connected, and there are clear cliques/communities that work together. If you were to construct a network of every single person on the planet, it would be sparsly connected, and it would also include communities. If you are reading this blog post, you are probably part of the IT community on LinkedIn, and the IT community has smaller communities for Data Science, Cybersecurity, Data Engineering, etc. Try to think about communities that you belong to, online and offline.In a network, a community is a group of connected things. In life, we are connected to people we interact with.What is a subgraph?In a network, a subgraph is similar to a community. A community IS a subgraph of the whole graph/network. Let's keep this simple:Graph: representation of the entire networkCommunity: connected things that are part of that graph; a smaller sectionSubgraph: a smaller section of the entire graphA subgraph is a smaller section of a larger graph. You can extract a part of the whole network for analysis, rather than working with the whole network.And a community is also a smaller section of a larger graph.But a subgraph does not need to be a community. For instance, if I wanted to see the subgraph of the whole graph that contained three nodes from community A and three nodes from community B, we'd likely end up with two separate networks. If you visualized it, you'd see two clusters.A community is a subgraph, but a subgraph is not necessarily a community. For instance, here is a subgraph taken from the larger Les Miserables network.We will explore subgraphs more throughout this adventure, as they are extremely useful.That's Enough for TodayI hope you found this to be an enjoyable read, and I hope my explanations made sense. This blog post was written quickly. If you would like to learn more about networks and network analysis, please buy a copy of my book!","['Community Detection', 'Graph Algorithms', 'Graph Visualization', 'Subgraphs and Connected Components', 'Whole Network Analysis']"
